{
  "$schema": "http://json-schema.org/draft-07/schema#",
  "title": "composite-spec",
  "type": "object",
  "required": ["name", "state"],
  "properties": {
    "name": {"type": "string", "minLength": 1},
    "description": {"type": "string"},
    "requires": {
      "type": "object",
      "additionalProperties": false,
      "properties": {
        "processes": {"type": "array", "items": {"type": "string"}},
        "types": {"type": "array", "items": {"type": "string"}}
      }
    },
    "parameters": {
      "type": "object",
      "additionalProperties": {
        "type": "object",
        "properties": {
          "type": {"enum": ["float", "int", "string", "str", "bool"]},
          "default": {},
          "description": {"type": "string"}
        }
      }
    },
    "state": {"type": "object"}
  }
}
